{
  "delivery_id": "dlv-1",
  "agent_id": "agent-2",
  "message_ref": {
    "message_id": "01JB0000000000000000000001",
    "from_agent": "agent-1",
    "priority": "NORMAL",
    "thread_id": "thread-1"
  },
  "notice_line": "[GIFFORD] 1 pending message from agent-1 (id 01JB0000000000000000000001). Read it with read_message and confirm with ack_message.",
  "orchestrator_decision_id": "01JB0000000000000000000002",
  "expected_state_version": 41,
  "expected_input_guard_version": 982,
  "expected_draft_generation": 17,
  "control_versions": {
    "global": 18,
    "node:node-a": 3,
    "agent:agent-1": 0,
    "agent:agent-2": 2,
    "link:agent-1→agent-2:message": 7,
    "thread:thread-1": 0,
    "loop:loop_01JB0000000000000000000003": 4,
    "loop_generation:loop_01JB0000000000000000000003": 1,
    "loop_override:loop_01JB0000000000000000000003": 0
  }
}
